{"task_id":"T-003","checker":"checker-courier","vendor":"openai","model":"gpt-5.6-terra","verdict":"pass","findings":[{"clause_id":"Stress-1","severity":"minor","description":"The argument order is correct because `$fallback` binds to `needle` and `$terminal_family` to `haystack`, while reversal tests the different predicate “fallback contains terminal family”; the supplied evidence does not expose live values to rule out an accidental reversed-form pass, but that would not make it equivalent.","evidence":"helpers.bash:7-10; brief.md:86-89"},{"clause_id":"Stress-2","severity":"minor","description":"The mutation/control reasoning is substantive and conditionally sound—an early false predicate followed by a later true one predicts helper failure and bare-`[[ ]]` success—but the supplied artifacts lack the two command transcripts, fixture contents/order, and a proof that only the assertion line differed, so differing setup or an unshown edit remains a theoretical alternative.","evidence":"prompt.txt:111-118; brief.md:95-103; bats-output.txt:1-45 contains only the ordinary 44-test pass"},{"clause_id":"Stress-3","severity":"minor","description":"The mutation strengthens correctness evidence for a latent defect but does not replace permanent coverage, since the ordinary fixture reaches the guarded assertion only for one non-empty fallback; a stable two-iteration fixture or dedicated regression case would better protect this behavior, though its absence is outside T-003’s mechanical-conversion scope.","evidence":"prompt.txt:122-126; line-554-context.txt:5-10"},{"clause_id":"Summary","severity":"info","description":"PASS is sound: the line-554 conversion preserves the predicate exactly, the diff shows all 12 requested replacements, and the full suite reports 44 passing tests; the unique concern is evidence provenance for the mutation control and missing ongoing multi-iteration coverage, not a defect in the conversion.","evidence":"diff.txt; full-bats.txt:1-46; helpers.bash:7-10"}],"timestamp":"2026-08-08T18:12:00Z","duration_ms":null,"cost_usd":null}