{
  "task_id": "T-004",
  "checker": "checker-judgment",
  "vendor": "anthropic",
  "model": "claude-opus-5[1m]",
  "verdict": "pass",
  "findings": [
    {
      "clause_id": "B-5",
      "severity": "blocker",
      "description": "A committed case exercises a blocked state on a clean tree and asserts the refusal, and it discriminates: relocating the guard below the clean-tree exit turns it red while the four dirty cases stay green.",
      "evidence": "CLAUSE SATISFIED, both halves.\n\nHALF 1 -- the committed case (tests/sync.bats:183-200), read line by line:\n  :184 fresh_repo                      -> builds its own repo, nothing written after\n  :185 git checkout -q --detach HEAD   -> blocked state, no file written\n  :187-188 porcelain=\"$(git -C \"$REPO\" status --porcelain)\"; [ -z \"$porcelain\" ]\n                                       -> pre-run porcelain asserted EMPTY\n  :192 run bash \"$SCRIPT\"              -> reaches the real script with a clean tree\n  :194 [ \"$status\" -ne 0 ]             -> refusal\n  :195 assert_contains \"$DETACHED_MSG\"          -> names its state\n  :196-197 assert_not_contains \"$REBASE_MSG\" / \"$MERGE_MSG\"  -> other two families absent\n  :198 assert_not_contains \"Nothing to commit. Already in sync.\"  -> the fall-through discriminator\n  :199 rev-list --count HEAD equals before_count captured at :190 -> no commit created\nThe needle at :198 is checked against $output, which is the same merged stream :26\n(`exec > >(tee -a \"$LOG\") 2>&1`) writes to $HOME/.local/state/dotfiles/last-sync.log,\nwith $HOME redirected to $BATS_TEST_TMPDIR/home at :32. Asserting the log and asserting\n$output are the same assertion here.\nNothing is written into the scratch repo between fresh_repo and the run: the only files\nunder $REPO are seed.txt from setup, and the :188 assertion is what proves it at run time.\n\nHALF 2 -- RELOCATION MUTATION (a move, not a deletion).\nDigest bracket BEFORE:\n  $ shasum -a 256 dot_local/bin/executable_dotfiles-sync\n  c90191bfb7fa6d48dc7deb5d6bb51fe41cebfa84446816ab206a2410fc04dc73\nBackup taken to an absolute path OUTSIDE the repo before any mutation\n(<scratch>/sync.orig, same digest). git commit / git reset / git checkout were never\nused on this file; the mutant went in with cp and came out with cp.\nMutation: script lines 130-151 (the guard comment + the if/elif/elif block) moved to sit\nBELOW the clean-tree early exit, which is at :153-156 in the working tree (:130-133 at the\n298c8a6 baseline the clause cites). Verified a pure relocation, not an edit:\n  $ diff <(sort sync.orig) <(sort sync.mutant)   -> identical multiset of lines\n  $ bash -n sync.mutant                          -> OK (parses; nothing flipped on syntax)\nMutant in place, digest 7865833e4cc311e2e2dbaa22d9a5f6321421876616b69ce0b1ee70355a93e21d:\n  $ bats tests/sync.bats\n  1..5\n  ok 1 sync: attached branch with no operation in progress commits normally\n  ok 2 sync: detached HEAD refuses, names itself, and leaves the repo untouched\n  ok 3 sync: rebase in progress refuses, names itself, and leaves the repo untouched\n  ok 4 sync: merge in progress refuses, names itself, and leaves the repo untouched\n  not ok 5 sync: detached HEAD refuses on a clean tree, before the clean-tree exit ever runs\n  # (in test file tests/sync.bats, line 194)\n  #   `[ \"$status\" -ne 0 ]' failed\nExactly the required discrimination: the new clean case goes red on the forbidden\nplacement while all four dirty cases stay green. This is the placement regression none of\nT-001's three per-detector deletions can catch, since every detector is still present and\nstill reachable on the dirty path.\nRestored with cp and verified:\n  $ diff <scratch>/sync.orig dot_local/bin/executable_dotfiles-sync   -> no output\nDigest bracket AFTER:\n  c90191bfb7fa6d48dc7deb5d6bb51fe41cebfa84446816ab206a2410fc04dc73   (matches)\n\nSUITE, post-restore:\n  $ bats --count tests/          -> 125          (above the required 124)\n  $ bats tests/                  -> exit 0; 125 'ok', 0 'not ok'\n  $ bats tests/lint.bats         -> exit 0; ok 1 no bare [[ or (( on the guarded surface\n  $ bats tests/sync.bats         -> 5/5 ok\n  $ git rev-parse HEAD           -> 298c8a69f839b336c248ec1b1b6607b4f43de589 (unchanged)\n\nNO PRE-EXISTING CASE TOUCHED, cross-checked two independent ways:\n  $ git diff 298c8a6 -- tests/ | grep -c '^-[^-]'   -> 0\n  (that command is vacuous on its own here, since tests/sync.bats is untracked, so:)\n  1. The LaunchAgent's incidental capture 75a2325 holds a 181-line tests/sync.bats\n     committed at 22:00:12, before the 22:06:13 mtime of the current 200-line file.\n     `diff -u 75a2325:tests/sync.bats tests/sync.bats` is one hunk, @@ -179,3 +179,22 @@,\n     19 added lines and 0 removed -- the harness at :1-118 and all four T-002 cases are\n     byte-identical.\n  2. Every line number the T-002 checker's own verdict cites still lands on the same\n     content: :25 SCRIPT, :27-29 the message constants, :107-118 fresh_repo, the four\n     @test headers at :120/:132/:148/:164, the marker builds at :134/:150/:169, the\n     invocations at :124/:139/:155/:174, and the assertion blocks at :126-129/:141-145/\n     :157-161/:176-180."
    },
    {
      "clause_id": "B-2",
      "severity": "blocker",
      "description": "The new case drives the real dotfiles-sync against its own freshly built throwaway repo, reimplements none of the guard's logic, and has no path to the real source dir if a stub fails.",
      "evidence": "CLAUSE SATISFIED. Both rubric questions answered from the file, then corroborated\nby behavior.\n\nQ1 -- does the new case invoke the real script, or assert against a copy of the guard's\nlogic? It invokes the real script. tests/sync.bats:192 is `run bash \"$SCRIPT\"`, with\nSCRIPT=\"$SRC/dot_local/bin/executable_dotfiles-sync\" at :25 and SRC=\"${BATS_TEST_DIRNAME}/..\"\nat :24. Grepping the new case's own 18 lines (:183-200) for guard predicates --\nsymbolic-ref, rebase-merge, rebase-apply, MERGE_HEAD -- returns nothing: there is no\nreimplementation to assert against. The only guard strings it touches are the shared\nconstants DETACHED_MSG / REBASE_MSG / MERGE_MSG at :27-29, used as assert_contains and\nassert_not_contains needles, never as logic. Corroborated behaviorally rather than taken\non the read: under the B-5 relocation mutation this case flipped to `not ok`, which is\nimpossible for a case asserting against a copy of the logic, since the copy did not move.\n\nQ2 -- its own fresh scratch repo, or another case's? Its own. :184 calls fresh_repo, which\nat :107-118 does `git init -q --bare \"$BATS_TEST_TMPDIR/origin.git\"` and\n`git init -q \"$REPO\"` with REPO=\"$BATS_TEST_TMPDIR/repo\", then seeds, commits, and pushes.\nNo reset, no clean, no reuse. I confirmed BATS_TEST_TMPDIR is genuinely per-@test on this\nbats (1.14.0) rather than assuming it, with a throwaway probe outside the repo:\n  A=/var/folders/.../bats-run-DFFLbq/test/1\n  B=/var/folders/.../bats-run-DFFLbq/test/2\n  ISOLATED        (a directory made in test A is absent in test B)\nSo the detached HEAD, the empty porcelain at :188 and the commit count at :190 all belong\nto this case alone.\n\nReachability of the real ~/.local/share/chezmoi, B-2's second half: the script derives\nSRC from `chezmoi source-path` at :18 under `set -euo pipefail` (:16). The harness exports\nan authoritative PATH at :48, `export PATH=\"$STUBS:/usr/bin:/bin\"` -- replaced, not\nprepended -- and the real binary lives only at /opt/homebrew/bin/chezmoi (`which -a\nchezmoi`; /usr/bin/chezmoi and /bin/chezmoi do not exist). A stub that failed to take\neffect therefore leaves `chezmoi` unresolvable and the run aborts at :18; there is no\nfallback path on which SRC could become the real source dir. $STUBS ($BATS_TEST_TMPDIR/\nstubs) and the redirected $HOME ($BATS_TEST_TMPDIR/home) are siblings of $REPO, not nested\ninside it, so neither leaves an untracked entry in the porcelain the case asserts empty."
    }
  ],
  "timestamp": "2026-08-09T03:18:16Z",
  "duration_ms": null,
  "cost_usd": null
}
