{
  "task_id": "T-009",
  "checker": "checker-judgment",
  "vendor": "anthropic",
  "model": "claude-opus-5[1m]",
  "verdict": "pass",
  "findings": [
    {
      "clause_id": "V-3",
      "severity": "blocker",
      "description": "The assembled suite runs green with nothing dropped: 120 cases, exit 0, no skips, and every per-file @test floor met.",
      "evidence": "$ timeout 300 bats tests/  -> SUITE EXIT=0\n1..120\nok lines: 120 / not ok lines: 0\ngrep -ci '# skip' over the TAP output -> 0 (exit 1, no skipped case)\n$ /usr/bin/grep -c '^@test' tests/<file>:\n  apps 18 (floor 18), doctor 11 (11), font 44 (44), install-failures 17 (17),\n  jsonc 9 (9), licensed-fonts 7 (7), packages 13 (13) = 119 across the seven\n  pre-existing files; tests/lint.bats adds 1, total 120.\n$ git diff 61213fe..HEAD -- tests/ | /usr/bin/grep -qE '^\\+[[:space:]]*skip\\b' -> exit 1\n  (exit 1 is the passing case; not exit 2, so the check did run)"
    },
    {
      "clause_id": "V-3",
      "severity": "blocker",
      "description": "Each of the five commits stands alone green, re-derived by checking out every sha in a scratch worktree and running the suite there.",
      "evidence": "Scratch worktree at scratchpad/agc-t009, detached at each sha in turn:\n  72154e3 exit=0 plan=1..119 ok=119 notok=0\n  6cc4fce exit=0 plan=1..119 ok=119 notok=0\n  7282d89 exit=0 plan=1..119 ok=119 notok=0\n  f317a69 exit=0 plan=1..120 ok=120 notok=0   (tests/lint.bats lands here)\n  814d917 exit=0 plan=1..120 ok=120 notok=0\n$ git worktree remove --force -> 'worktree removed'; git worktree list shows only the repo."
    },
    {
      "clause_id": "B-1",
      "severity": "blocker",
      "description": "No bare [[ or (( survives anywhere on the guarded surface, including tests/install-failures.bats, which two tasks edited and no task owned.",
      "evidence": "$ /usr/bin/grep -nE '^[[:space:]]*(\\[\\[|\\(\\()' tests/*.bats tests/helpers.bash tests/mutation-check.sh\n(no output)\nB-1 exit=1  -- exit 1 with empty stdout is the pass; exit 2 (missing file / bad pattern)\nwould have been blocked, and did not occur. Run with /usr/bin/grep explicitly, not the\nugrep shim, per the constitution's note to checkers.\nConfirmed in-suite as well: TAP line 'ok 107 no bare [[ or (( on the guarded surface'."
    },
    {
      "clause_id": "D-1",
      "severity": "blocker",
      "description": "The commit-range diff touches only tests/ and the two working-memory files; nothing under dot_local/, no .chezmoidata.toml, no run_onchange_* template.",
      "evidence": "$ git diff --name-only 61213fe..HEAD\n_working-memory/conventions.md\n_working-memory/decisionLog.md\ntests/apps.bats\ntests/doctor.bats\ntests/font.bats\ntests/helpers.bash\ntests/install-failures.bats\ntests/jsonc.bats\ntests/licensed-fonts.bats\ntests/lint.bats\ntests/mutation-check.sh\ntests/packages.bats\nEleven paths, all inside the allowlist. The commit range carries this because\ncheck-diff-scope.py reads only the working tree and goes vacuous once the work is committed."
    },
    {
      "clause_id": "D-3",
      "severity": "major",
      "description": "Five commit messages, each covering why at least as much as what, each intelligible cold a year out; none merely restates its diff.",
      "evidence": "$ git log --format=%s 61213fe..HEAD (newest first):\n  docs(memory): write down the bash 3.2 errexit rule and the incident behind it\n  test: fail the suite if a bare [[ or (( comes back\n  test: prove every converted assertion can still go red\n  test: convert all 54 bare compound statements to forms that actually fail\n  test: share the assertion helpers instead of hiding them in one file\nRead in full from `git log --format=%B 61213fe..HEAD`. Each body argues a cause, not a filelist:\n- 72154e3 opens on why the helpers had to move -- bash 3.2 'throws away a failing [[ ]] unless\n  that construct is the enclosing function's literal last statement' -- and closes on drift:\n  'one definition of each name rather than seven'.\n- 6cc4fce reproduces the bug inline ('f() { [[ 1 -eq 2 ]]; echo reached; } prints reached and\n  exits 0 under set -e') and then argues down #21's figure of 24 with the loop counterexample,\n  which is why there is no safe-by-position carve-out. Records the two judgment calls\n  (packages.bats:146, doctor.bats:244) with the reasoning for each.\n- 7282d89 states why exit status is not the proof: 'a mutation that breaks bash parsing collapses\n  the file to a synthetic not ok 1 setup_file failed with the mutated case never running at all',\n  and volunteers the harness's own near-miss (a heredoc tracker blind to <<-'STUB' silently\n  reported zero sites for font.bats).\n- f317a69 explains why the guard is a bats case rather than a script ('a second entry point is one\n  a contributor or a CI job can forget about'), why a first-token grep was not enough (a planted\n  `true; [[ 1 -eq 2 ]]` passed it), and why if/while/until conditions are deliberately unscanned.\n- 814d917 says why an unexplained convention fails ('the kind that gets overridden the first time\n  it looks inconvenient') and carries the #17 incident behind the rule.\nNone is a restatement of its diff; all five would read cold."
    },
    {
      "clause_id": "D-3",
      "severity": "major",
      "description": "No attribution trailer in the range, no hard-wrapped body lines, tree clean, nothing pushed, and no machine-authored auto-sync commit.",
      "evidence": "$ git log --format=%B 61213fe..HEAD | /usr/bin/grep -niE 'co-authored-by|signed-off-by|generated with|assisted-by|noreply@anthropic'\n  -> exit 1, no output. No trailers.\n$ line-length histogram over all non-empty message lines:\n  50, 54, 68, 73, 77 (the five subjects), then 168 180 183 211 218 241 256 260 292 299 303\n  312 326 350 355 369 406 424 486 -- every body line is one full paragraph. A hard wrap would\n  show a cluster in the 60-80 band; there is none.\n$ git status --porcelain -> 0 lines. Clean tree.\n$ for s in $(git rev-list 61213fe..HEAD); do git branch -r --contains $s; done\n  814d917 remote-branches: []\n  f317a69 remote-branches: []\n  7282d89 remote-branches: []\n  6cc4fce remote-branches: []\n  72154e3 remote-branches: []\n  Remote refs that exist to be named: origin/HEAD, origin/dotfiles-apps, origin/main,\n  origin/rescue-autosync. None contains any of the five. Nothing was pushed.\n$ git log --format=%s 61213fe..HEAD | /usr/bin/grep -c '^\\[auto-sync from' -> 0 (exit 1).\n  The LaunchAgent did not fire; no blocked condition."
    },
    {
      "clause_id": "D-3",
      "severity": "major",
      "description": "The worker's index-only split claim holds: the committed tree over tests/ is byte-identical to the working tree, so what the suite verifies is what got committed.",
      "evidence": "$ git diff 61213fe..HEAD -- tests/  > range.diff   (974 lines)\n$ git diff 61213fe      -- tests/  > wt.diff\n$ diff range.diff wt.diff -> exit 0, no output.\nThe commit-range diff and the baseline-to-working-tree diff are the same 974 lines, so HEAD's\ntests/ tree equals the tree the 120-case green run above was taken against."
    }
  ],
  "timestamp": "2026-08-08T20:09:24Z",
  "duration_ms": null,
  "cost_usd": null
}
