{
    "task_id": "T-001",
    "checker": "checker-courier",
    "vendor": "openai",
    "model": "gpt-5.6-terra",
    "verdict": "fail",
    "findings": [
        {
            "clause_id": "B-3",
            "severity": "blocker",
            "description": "The supplied evidence supports B-3's shared-helper, removal, and discriminating-probe requirements.",
            "evidence": "Definition count is 2; all seven named pre-existing .bats files are listed by the load check; install-failures.bats has no matching local definition; helper probe reports both cases `not ok` while the otherwise-equivalent bare `[[ ]]` probe reports both `ok`, demonstrating the intended propagation distinction."
        },
        {
            "clause_id": "B-1",
            "severity": "blocker",
            "description": "The supplied B-1 evidence is insufficient because it checks only tests/helpers.bash rather than the entire guarded surface.",
            "evidence": "Provided command/output cover `tests/helpers.bash` only; no command output is supplied for `tests/*.bats` or `tests/mutation-check.sh`, which are required by B-1."
        }
    ],
    "timestamp": "2026-08-08T00:00:00Z",
    "duration_ms": null,
    "cost_usd": null
}
