{
  "task_id": "T-001",
  "checker": "checker-deterministic",
  "vendor": "anthropic",
  "model": "claude-haiku-4-5-20251001",
  "verdict": "pass",
  "findings": [
    {
      "clause_id": "V-2.1",
      "severity": "blocker",
      "description": "Suite terminates and exits 0: timeout 300 bats tests/ completed successfully with all 102 tests passing.",
      "evidence": "Exit code: 0, output shows: 1..102 with all ok results"
    },
    {
      "clause_id": "V-2.2",
      "severity": "blocker",
      "description": "All test case counts meet or exceed baseline requirements: apps 18 (require 18), doctor 11 (require 10), font 44, jsonc 9, licensed-fonts 7, packages 13.",
      "evidence": "grep -c '^@test' results: apps=18, doctor=11, font=44, jsonc=9, licensed-fonts=7, packages=13"
    },
    {
      "clause_id": "V-2.3",
      "severity": "blocker",
      "description": "No test cases deleted or skipped: git diff -- tests/apps.bats adds no line matching ^\\+[[:space:]]*skip\\b.",
      "evidence": "grep -E '^\\+[[:space:]]*skip\\b' on git diff output returned exit code 1 (no matches)"
    },
    {
      "clause_id": "V-2.4",
      "severity": "major",
      "description": "Scope verification: only in-scope paths modified. dot_local/bin/executable_dotfiles-apps unchanged. Concurrent task artifacts (tests/doctor.bats) noted.",
      "evidence": "git status --porcelain shows only tests/apps.bats (in scope), tests/doctor.bats (concurrent), and dot_claude/encrypted_private_settings.json.age (predates job). git diff --stat -- dot_local/ shows no changes."
    }
  ],
  "timestamp": "2026-08-07T04:30:07Z",
  "duration_ms": null,
  "cost_usd": null
}
