{"task_id":"T-001","checker":"checker","vendor":"openai","model":"gpt-5.6-terra","verdict":"fail","findings":[{"clause_id":"V-3","severity":"major","description":"The PASS reasoning improperly treats the log as curing an incomplete desktop refusal: the notification, the channel V-3 expressly requires to reach the user, omits the required directory and `recovered-<sha>` argument, and no evidence shows that its complete log/terminal counterpart is presented at the moment of failure.","evidence":"attack_prompt.md:39-40,47-58; a conclusive pass would need proof that the full echoed command is part of the user-visible refusal or a complete command in each `notify_fail` body."},{"clause_id":"V-3","severity":"minor","description":"The work-preservation attack does not establish a defect in the full logged command, because `git switch -c recovered-<sha>` while detached creates and checks out a branch at the current commit, but the checker supplied no before/after ref evidence and its safe command is still unavailable in the desktop text.","evidence":"attack_prompt.md:37-40,73-84; the missing confirmation is a fixture showing `git symbolic-ref -q HEAD` succeeds afterward and the pre-recovery SHA is reachable from `recovered-<sha>`."},{"clause_id":"D-4","severity":"minor","description":"Nothing in the displayed hunk itself appears orthogonal to the guard—`head_sha` is the only new shell variable and the comments, tests, messages, and exits implement detection or state-specific recovery—but the checker’s categorical scope conclusion cannot be independently verified from this excerpt because it relies on an unstated baseline and full diff.","evidence":"attack_prompt.md:21-42,94-116; conclusive D-4 evidence would include the complete baseline search for `head_sha` and the complete task diff, including the push-failure-classifier region."}],"timestamp":"2026-08-09T02:27:08Z","duration_ms":null,"cost_usd":null}