{"task_id":"T-002","checker":"checker-courier","vendor":"openai","model":"gpt-5.6-terra","verdict":"pass","findings":[{"clause_id":"B-2","severity":"info","description":"Each polarity mutation is causal evidence: the changed assertion is the final command in its otherwise passing test, so a new red case cannot be caused by a later command and the single flipped condition is load-bearing.","evidence":"doctor-baseline.bats:119-229; doctor-diff.txt:45-99; full-prompt.txt:287-297"},{"clause_id":"B-2","severity":"info","description":"The `undeclared` arm is unexercised by today’s fixture, but that is a coverage limitation rather than evidence that the baseline contract was defective; retaining both arms faithfully preserves the original disjunction.","evidence":"doctor-diff.txt:101-117; full-prompt.txt:301-306"},{"clause_id":"B-2","severity":"info","description":"The cited helpers preserve the baseline checks because `assert_contains` performs a fixed-string substring search and `assert_not_contains` negates the same quoted substring match against the default `$output` haystack.","evidence":"helpers.bash:1-2; doctor-diff.txt:1-134"}],"timestamp":"2026-08-08T18:09:38Z","duration_ms":null,"cost_usd":null}