{"task_id": "T-005", "checker": "checker-courier", "vendor": "openai", "model": "gpt-5.6-terra", "verdict": "pass", "findings": [{"clause_id": "B-2", "severity": "minor", "description": "The polarity cluster is preserved: lines 62 and 70 correctly require their needles, while line 63 correctly rejects the same \"not in vault\" needle in its separate test.", "evidence": "licensed-fonts.bats baseline/working evidence at lines 62-63 and 70; helpers.bash definitions."}, {"clause_id": "B-2", "severity": "minor", "description": "The single-bracket guard preserves empty-cask loop skipping under Bash 3.2: its nonzero result is in an || list, so continue executes without an errexit difference.", "evidence": "packages.bats:146 and supplied loop context at lines 143-151."}, {"clause_id": "B-2", "severity": "minor", "description": "No helper conversion weakens a supplied baseline substring check: assert_contains uses fixed-string presence matching and assert_not_contains rejects the same literal substring.", "evidence": "All 10 supplied assertion conversion pairs; tests/helpers.bash helper definitions."}], "timestamp": "2026-08-08T18:06:01Z", "duration_ms": null, "cost_usd": null}