{
  "task_id": "T-003",
  "checker": "checker-deterministic",
  "vendor": "anthropic",
  "model": "claude-haiku-4-5-20251001",
  "verdict": "pass",
  "findings": [
    {
      "clause_id": "D-4",
      "severity": "blocker",
      "description": "The test file defines a recording defaults stub and every raycast case has it on PATH.",
      "evidence": "tests/install-failures.bats:49-58 define stub_defaults(); lines 196, 204, 227, 248 call it before raycast cases; all raycast cases use PATH=$STUBS:/bin"
    },
    {
      "clause_id": "B-3",
      "severity": "blocker",
      "description": "All 15 test cases pass with exit status 0, satisfying both continuation and exit code requirements.",
      "evidence": "bats tests/install-failures.bats: TAP output shows 1..15 with all ok"
    },
    {
      "clause_id": "V-1",
      "severity": "blocker",
      "description": "The test file contains exactly 15 cases with all required titles present in correct format.",
      "evidence": "grep -c '^@test' tests/install-failures.bats: 15; all four script names with all four title patterns verified present"
    },
    {
      "clause_id": "V-1",
      "severity": "blocker",
      "description": "Every case asserts status -eq 0 with no forbidden status -ne 0 or -eq 1 assertions.",
      "evidence": "grep -c 'status\" -eq 0' tests/install-failures.bats: 16; grep 'status\" -(ne|eq) [1-9]' tests/install-failures.bats: (no matches)"
    },
    {
      "clause_id": "V-1",
      "severity": "blocker",
      "description": "Script resolution is relative via SRC variable with no chezmoi source-path usage.",
      "evidence": "tests/install-failures.bats:19 contains SRC=\"${BATS_TEST_DIRNAME}/..\"; grep 'chezmoi source-path' tests/install-failures.bats: (no matches)"
    },
    {
      "clause_id": "V-1",
      "severity": "blocker",
      "description": "All 15 test cases against baseline scripts at 1dec91c match expected outcomes from constitution table.",
      "evidence": "Worktree baseline test results: install-packages absent ok (expected ok), install-packages failing not ok (expected not ok), install-packages success ok (expected ok), install-vscode-extensions absent ok (expected ok), install-vscode-extensions failing not ok (expected not ok), install-vscode-extensions keeps-going ok (expected ok), install-vscode-extensions success ok (expected ok), configure-raycast absent not ok (expected not ok), configure-raycast failing not ok (expected not ok), configure-raycast keeps-going ok (expected ok), configure-raycast success ok (expected ok), install-claude-plugins absent ok (expected ok), install-claude-plugins failing not ok (expected not ok), install-claude-plugins keeps-going ok (expected ok), install-claude-plugins success ok (expected ok)"
    }
  ],
  "timestamp": "2026-08-07T00:00:00Z",
  "duration_ms": null,
  "cost_usd": null
}
