{
  "task_id": "T-006",
  "checker": "checker-deterministic",
  "vendor": "anthropic",
  "model": "claude-haiku-4-5-20251001",
  "verdict": "pass",
  "findings": [
    {
      "clause_id": "V-1",
      "severity": "blocker",
      "description": "Part 1: bats tests/lint.bats exits 0 against the converted suite, and bats tests/ is green at 120 cases.",
      "evidence": "bats tests/lint.bats: 1..1, ok 1 no bare [[ or (( on the guarded surface. bats tests/: 1..120 with final case ok 120 every bundle in the catalog is reachable from some role's defaults"
    },
    {
      "clause_id": "V-1",
      "severity": "blocker",
      "description": "Part 2, Planting 1 (tests/jsonc.bats with [[): guard correctly reports not ok.",
      "evidence": "bats --formatter tap tests/lint.bats output: 1..1, not ok 1 no bare [[ or (( on the guarded surface. Hit found at /tmp/agc-lint/tests/jsonc.bats:94"
    },
    {
      "clause_id": "V-1",
      "severity": "blocker",
      "description": "Part 2, Planting 2 (tests/helpers.bash with [[): guard correctly reports not ok. This planting proves the guard scans all three file kinds, not just *.bats.",
      "evidence": "bats --formatter tap tests/lint.bats output: 1..1, not ok 1 no bare [[ or (( on the guarded surface. Hit found at /tmp/agc-lint/tests/helpers.bash:20"
    },
    {
      "clause_id": "V-1",
      "severity": "blocker",
      "description": "Part 2, Planting 3 (tests/mutation-check.sh with [[): guard correctly reports not ok.",
      "evidence": "bats --formatter tap tests/lint.bats output: 1..1, not ok 1 no bare [[ or (( on the guarded surface. Hit found at /tmp/agc-lint/tests/mutation-check.sh:350"
    },
    {
      "clause_id": "V-1",
      "severity": "blocker",
      "description": "Part 2, Planting 1 repeat (tests/jsonc.bats with (( ))): guard correctly reports not ok for double-paren syntax.",
      "evidence": "bats --formatter tap tests/lint.bats output: 1..1, not ok 1 no bare [[ or (( on the guarded surface. Hit found at /tmp/agc-lint/tests/jsonc.bats:94 with (( 1 == 1 ))"
    },
    {
      "clause_id": "V-1",
      "severity": "blocker",
      "description": "Guard resolves paths from BATS_TEST_DIRNAME rather than $PWD, as required.",
      "evidence": "tests/lint.bats lines 41-44 show explicit use of $BATS_TEST_DIRNAME in path construction, not $PWD or absolute paths"
    },
    {
      "clause_id": "V-1",
      "severity": "blocker",
      "description": "Worktree cleanup successful and git status unchanged.",
      "evidence": "git status --porcelain tests/ identical before and after mutation block: 7 modified .bats files, 3 untracked (helpers.bash, lint.bats, mutation-check.sh)"
    },
    {
      "clause_id": "B-1",
      "severity": "blocker",
      "description": "Grep check exits 1 with no output; guard does not flag its own source.",
      "evidence": "/usr/bin/grep -nE '^[[:space:]]*(\\[\\[|\\(\\()' tests/lint.bats exits 1 with no output"
    }
  ],
  "timestamp": "2026-08-08T19:00:47Z",
  "duration_ms": null,
  "cost_usd": null
}