{
  "task_id": "T-004",
  "checker": "checker-deterministic",
  "vendor": "anthropic",
  "model": "claude-haiku-4-5-20251001",
  "verdict": "pass",
  "timestamp": "2026-08-06T21:00:00Z",
  "duration_ms": null,
  "cost_usd": null,
  "findings": [
    {
      "clause_id": "V-3",
      "severity": "pass",
      "description": "The test case exists with the correct title at line 92 of tests/doctor.bats.",
      "evidence": "grep output: 92:@test \"doctor: a tracked but uninstalled formula is reported\" {"
    },
    {
      "clause_id": "V-3",
      "severity": "pass",
      "description": "All 11 test cases pass at HEAD including the new case.",
      "evidence": "bats --formatter tap tests/doctor.bats output:\n1..11\nok 1 doctor: a tracked but uninstalled formula is reported\nok 2 says nothing when every declared cask is tracked\nok 3 names the key, the half and the cask when the registry is missing one\nok 4 a formula does not satisfy a cask dependency\nok 5 matches the whole cask name, not a prefix of a longer one\nok 6 a cask in a bundle this machine hasn't enabled is a gap\nok 7 an empty list is fine on Tier C, which is fetched from 1Password\nok 8 an empty list is a gap on a tier that installs from Homebrew\nok 9 a half with no casks key at all is reported as undeclared\nok 10 skips rather than dies when there is no registry to read\nok 11 the repo's own font registry and package registry agree"
    },
    {
      "clause_id": "V-3",
      "severity": "pass",
      "description": "Mutation test proves the new case exercises the claimed branch: it fails when lines 58-68 deleted from doctor, confirming the cp command was executed.",
      "evidence": "bats --formatter tap in /tmp/agc-t004-check2 with deleted doctor branch:\nnot ok 1 doctor: a tracked but uninstalled formula is reported\nok 2 says nothing when every declared cask is tracked\nok 3 names the key, the half and the cask when the registry is missing one\nTests 4-11 remain ok. Worktree successfully cleaned up."
    },
    {
      "clause_id": "V-3",
      "severity": "pass",
      "description": "Test case count is 11 (exceeds minimum of 10) and no skips were added in the diff.",
      "evidence": "grep -c '^@test' tests/doctor.bats = 11\ngit diff -- tests/doctor.bats | grep -E '^\\+[[:space:]]*skip\\b' = 0 lines"
    },
    {
      "clause_id": "V-3",
      "severity": "pass",
      "description": "No changes to dot_local/ directory, scope is respected.",
      "evidence": "git diff --stat -- dot_local/ = (empty output)"
    }
  ]
}
